{
  "phase_id": "P02",
  "phase_name": "Development Environment",
  "description": "Establish professional development environment with automated code quality tools, virtual environments, secrets management, and AI-assisted development workflows. Master the tooling foundation that will support efficient, high-quality Catchbook development.",
  "catchbook_focus": "Configure a production-ready development environment for Catchbook with ESLint, Prettier, pre-commit hooks, Claude Code CLI, Python virtual environments, environment variable management, and proper .gitignore patterns. Set the standard for professional repository hygiene.",
  "entry_criteria": [
    "Completed Phase 1 (Git fundamentals, branching, PR workflow, Issues/Projects)",
    "Catchbook repository initialized with professional README",
    "VS Code or preferred IDE configured",
    "Node.js and npm installed (v18+ recommended)",
    "Python 3.10+ installed",
    "Git hooks capability (Husky compatible)"
  ],
  "exit_criteria": [
    "Catchbook repository with linting and formatting enforced on every commit",
    "Claude Code CLI configured with comprehensive CLAUDE.md context file",
    "Python virtual environment (venv or Poetry) active for Catchbook backend",
    ".env file structure implemented with secrets properly managed",
    "Production-ready .gitignore covering Node, Python, and IDE artifacts",
    "Pre-commit hooks blocking commits with quality violations",
    "Demonstrated ability to use Claude Code for common development tasks"
  ],
  "estimated_hours": 28,
  "modules": [
    {
      "module_id": "P02-M01",
      "module_name": "Development tools: ESLint, Prettier, hooks, Claude Code",
      "estimated_hours": 10,
      "catchbook_deliverable": "Claude Code configured for Catchbook project with CLAUDE.md context"
    },
    {
      "module_id": "P02-M02",
      "module_name": "Virtual environments (venv poetry) + package management",
      "estimated_hours": 6,
      "catchbook_deliverable": "Python project template for Catchbook"
    },
    {
      "module_id": "P02-M03",
      "module_name": "Environment variables + secrets management",
      "estimated_hours": 6,
      "catchbook_deliverable": ".env-based config for Catchbook APIs"
    },
    {
      "module_id": "P02-M04",
      "module_name": ".gitignore patterns + directory structure",
      "estimated_hours": 6,
      "catchbook_deliverable": "Production-ready Catchbook file structure"
    }
  ],
  "metadata": {
    "created_at": "2025-12-06",
    "updated_at": "2025-12-06"
  }
}
