{
  "phase_id": "P21",
  "phase_name": "DevOps & Deployment",
  "description": "Deploy Catchbook to production with professional CI/CD pipelines, containerization, multi-environment management, and AI-assisted code review. Master the infrastructure and automation needed to ship reliably and iterate quickly.",
  "catchbook_focus": "Build and deploy Catchbook's complete infrastructure: GitHub Actions CI/CD, Docker containers for backend and frontend, production deployments on Railway/Render/Fly.io and Vercel/Netlify, automated AI code review with Claude Code, and separate dev/staging/prod environments.",
  "entry_criteria": [
    "Completed Phase 20 (Performance optimization)",
    "Catchbook MVP feature-complete locally",
    "Test suite passing with >80% coverage",
    "Environment variables documented",
    "Docker installed locally",
    "GitHub repository configured with appropriate secrets",
    "Claude Code CLI experience from Phases 2 and 15"
  ],
  "exit_criteria": [
    "CI pipeline running lint, test, and build on every PR",
    "Dockerized backend and frontend services with multi-stage builds",
    "Backend deployed to production (Railway, Render, or Fly.io)",
    "Frontend deployed to production (Vercel or Netlify)",
    "Automated Claude Code review integrated into PR workflow",
    "Separate dev, staging, and production environments configured",
    "Automated batch refactoring capability demonstrated",
    "Cost monitoring and budget alerts for CI-based AI usage",
    "Zero-downtime deployment strategy documented",
    "Catchbook accessible via public URL with SSL/HTTPS"
  ],
  "estimated_hours": 58,
  "modules": [
    {
      "module_id": "P21-M01",
      "module_name": "GitHub Actions: lint test build",
      "estimated_hours": 10,
      "catchbook_deliverable": "CI pipeline for Catchbook"
    },
    {
      "module_id": "P21-M02",
      "module_name": "Docker containerization (backend + frontend)",
      "estimated_hours": 12,
      "catchbook_deliverable": "Dockerized Catchbook services"
    },
    {
      "module_id": "P21-M03",
      "module_name": "Backend deployment (Railway Render Fly.io)",
      "estimated_hours": 10,
      "catchbook_deliverable": "Deployed API endpoint"
    },
    {
      "module_id": "P21-M04",
      "module_name": "Frontend deployment (Vercel Netlify)",
      "estimated_hours": 8,
      "catchbook_deliverable": "Deployed React app"
    },
    {
      "module_id": "P21-M05",
      "module_name": "Environment management (dev staging prod)",
      "estimated_hours": 8,
      "catchbook_deliverable": "Multi-environment setup"
    },
    {
      "module_id": "P21-M06",
      "module_name": "Claude Code in CI/CD pipelines",
      "estimated_hours": 10,
      "catchbook_deliverable": "CI pipeline with Claude Code automated code review"
    }
  ],
  "metadata": {
    "created_at": "2025-12-06",
    "updated_at": "2025-12-06"
  }
}
